{
  "version": "1.0",
  "approvalId": "77777777-7777-4777-8777-777777777777",
  "jobId": "11111111-1111-4111-8111-111111111111",
  "correlationId": "aaaaaaaa-aaaa-4aaa-8aaa-aaaaaaaaaaaa",
  "requestedAt": "2026-08-20T20:00:04Z",
  "requestedBy": "CORE",
  "status": "PENDING",
  "action": "GRANT_DISCOUNT",
  "reasonCode": "RHIA_APPROVAL_DISCOUNT_REQUIRED",
  "summary": "Se requiere decisión humana antes de modificar el descuento.",
  "targetRef": "88888888-8888-4888-8888-888888888888",
  "expiresAt": "2026-08-21T20:00:04Z"
}
